{"$schema":"https://json-schema.org/draft/2020-12/schema","title":"AndyAI Execution Plan","type":"object","required":["type","id","goal","status","requires_human_approval","steps","stop_conditions"],"properties":{"type":{"const":"execution_plan"},"id":{"type":"string"},"goal":{"type":"string"},"status":{"type":"string"},"requires_human_approval":{"type":"boolean"},"steps":{"type":"array","items":{"type":"string"}},"stop_conditions":{"type":"array","items":{"type":"string"}}}}
